id,userid,title,description,viewers,editors,object_stories,references,events,plots,stories,ca_sec_id,private,EOL
dossier1,user2,Sir Denis Mahon,"In 2010, Sir Denis Mahon, one of the most distinguished art historians and collectors of the twentieth century, presented his personal library and archive to the National Gallery of Ireland. Of Irish descent, Sir Denis had a long and close association with the Gallery having donated a gift of eight outstanding seventeenth-century Baroque pictures to the collection. His munificence is considered the most important to the Gallery in recent years and has added significantly to its holdings of Baroque art and its research collections. <br >Sir Denis’s remarkable library reflects his scholarly interests covering art in the Western European tradition from classical<br >times onwards. Italian art is strongly represented, particularly the baroque period, while British, Dutch, French and Spanish art also feature prominently. Many rare and antiquarian volumes, which are regarded as key sources in the study of art, have also been included in this gift.<br >Sir Denis’s fascinating archive consists of a vast hoard of correspondence relating to collections and individual works of art, in particular Italian art and artists. Academic notes and material containing information gathered and created by Sir Denis throughout his life are central to the archive. In addition there are papers relating to his work with various committees and boards and his lobbying on behalf of the arts. Extensive family archives provide details of the Mahon, Browne and Vesey families of Castlegar Co. Galway, and Westport Co. Mayo. Furniture, silver and some artworks were also presented as part of the gift.",user2|user3|user5|user6|user7|user12|user14|user15|user16|user17|user18|user19|user20|user21|user22|user23|user24|user25|user26,user1|user2|user3|user4|user5|user6|user7|user8|user9|user10|user11|user12|user13|user14|user15|user16|user17|user18|user19|user20|user21|user22|user23|user24|user25|user26|user27,objectstory12|objectstory13|objectstory14|objectstory15|objectstory16|objectstory17|objectstory18|objectstory19|objectstory20|objectstory23|objectstory24|objectstory42|objectstory57|objectstory55|objectstory62|objectstory63|objectstory65|objectstory69|objectstory70|objectstory71|objectstory73|objectstory80|objectstory83|objectstory100|objectstory114|objectstory124|objectstory126|objectstory129|objectstory160|objectstory162|objectstory163|objectstory166|objectstory171|objectstory172|objectstory173|objectstory175|objectstory176|objectstory177|objectstory178|objectstory195|objectstory225|objectstory227|objectstory97|objectstory206|objectstory233|objectstory314|objectstory315|objectstory316|objectstory317|objectstory318|objectstory319|objectstory320|objectstory321|objectstory322|objectstory323|objectstory324|objectstory325|objectstory326|objectstory327|objectstory328|objectstory329|objectstory330,ref1|ref2,event101|event102|event103|event104|event106|event107|event108|event109|event110|event111|event112|event113|event114|event115|event116|event117|event118|event119|event120|event121|event121|event122|event123|event124|event125|event126|event127|event128|event129|event129|event130|event131|event32|event33|event34|event35|event36|event37|event38|event39|event40|event41|event43|event44|event45|event46|event47|event48|event49|event50|event51|event52|event53|event54|event55|event56|event57|event58|event59|event60|event61|event62|event63|event64|event65|event66|event67|event68|event69|event70|event71|event72|event73|event74|event75|event76|event77|event78|event79|event80|event81|event82|event83|event84|event85|event86|event87|event88|event90|event91|event92|event93|event94|event95|event96|event97|event98|event99|event100|event181|event182|event183|event184|event185|event186|event187|event188|event189|event190|event191|event192|event193|event194|event195|event196|event197|event198|event199|event202|event204|event205|event207|event208|event209|event210|event211|event212|event213|event214|event215|event216|event217|event218|event219|event220|event221|event222|event223|event224|event225|event226|event227|event228|event232|event233|event234|event236|event237|event238|event239|event240|event241|event242|event243|event244|event245|event246|event247|event248|event249|event250|event251|event252|event253|event254|event255|event256|event257|event258|event259|event260|event261|event262|event263|event264|event265|event1036|event1037|event1038|event1039|event1040|event1041|event1042|event1043|event1044|event1045|event1046|event1047|event1048|event1049|event1050|event1051|event1052,plot101|plot102,story102,5b27c09e-8041-11e2-8753-002590937d1c,1,EOL
dossier2,user6,Irish Art and Modernism in the 20th-century," A history of Irish Art in the 20th-century and its relationship with Modernism, based on The Moderns, an exhibition at the Irish Museum of Modern Art (IMMA) from October 2010 to April 2011.<br >“The Moderns exhibition at IMMA presented a survey of Irish Art from the 1900s to the 1970s, covering the whole period of what is widely referred to as Modernism. It was a period which extended from Roderic O’Conor and William Leech to Sean Scully and James Coleman. During these years the idea of progress was unquestionable, generating constant and radical formal innovations in the arts giving rise to movements such as Cubism, Expressionism, Surrealism and different forms of abstraction.<br >This course began to change in the late 1960s and early 1970s, after the appearance of Conceptual Art, when meaning was seen as something as important as form, a situation which still pertains today.<br >It has very often been said that Modernism did not really happen in Ireland, but clearly a lot of the best art produced here demonstrates a knowledge and awareness of international ideas, even if those were filtered through or tinted with local myths, beliefs, traditions, history or politics.<br >Some major figures and movements such as J.M. Synge, Eileen Gray, Mainie Jellett and Cubism, Jack B. Yeats, Social Realism, Surrealism, Louis le Brocquy, Samuel Beckett, William Scott, Scott Tallon Walker, Patrick Scott, Kinetic Art, Brian O’Doherty, Pop Art, James Coleman and Michael Craig-Martin and the beginning of Conceptualism. The Moderns’ focus was on the arts in Ireland, but also included some works of non-Irish artists, whose influence has had special relevance to what was being done here, such as Oskar Kokoschka, Giorgio de Chirico, Lucian Freud, Pierre Soulages and Patrick Caulfield.”<br >The Moderns exhibition was curated by Christina Kennedy, Senior Curator, Head of Collections and Enrique Juncosa, Director, IMMA, with the assistance of Brian Cass, Curatorial Co-ordinator, Nuria Carballeira, Collections Registrar (acting), Séamus McCormack, Assistant Curator, Johanne Mullan, National Programmer, Marguerite O’Molloy, Assistant Curator, Georgie Thompson Assistant, Curator, Hannah Brogan and Barry Kehoe.<br >""Visiting an Art Museum or Gallery: Resources for second level students and teachers for the exhibition The Moderns"" was prepared by Lisa Moran, Curator: Education and Community Programmes and Rebecca Devaney, Advisor and Second Level Art Teacher , with thanks to Christina Kennedy, Senior Curator: Head of Collections, Georgie Thompson, Assistant Curator: Collections, Séamus McCormack, Assistant Curator: Collections, and Sophie Byrne, Assistant Curator: Talks and Lectures Programme.<br >The texts in this Dossier draw on publications and resources provided by IMMA for the public, as well as online sources such as Wikipedia.",user2|user3|user5|user6|user7|user12|user14|user15|user16|user17|user18|user19|user20|user21|user22|user23|user24|user25|user26|user27|user28,user1|user2|user3|user4|user5|user6|user7|user8|user9|user10|user11|user12|user13|user14|user15|user16|user17|user18|user19|user20|user21|user22|user23|user24|user25|user26|user27,objectstory502|objectstory503|objectstory504|objectstory505|objectstory506|objectstory507|objectstory508|objectstory509|objectstory510|objectstory511|objectstory512|objectstory513|objectstory514|objectstory515|objectstory516|objectstory517|objectstory518|objectstory519|objectstory520|objectstory521|objectstory522|objectstory523|objectstory524|objectstory701|objectstory702|objectstory703|objectstory704|objectstory705|objectstory706|objectstory707|objectstory708|objectstory709|objectstory710|objectstory711|objectstory712|objectstory713|objectstory714|objectstory715,ref7,event1008|event1028|event132|event134|event135|event140|event141|event142|event143|event144|event145|event146|event147|event148|event149|event150|event151B|event152|event153|event154|event155|event156|event157|event158|event159|event160|event161|event163|event164|event165|event166|event167|event168|event170|event171|event172|event173|event174|event175|event176|event177|event178|event179|event2|event23|event24|event27|event400|event401|event402|event414|event415|event416|event417|event418|event419|event420|event421|event422|event423|event424|event425|event426|event427|event428|event429|event430|event431|event432|event433|event434|event435|event436|event437|event438|event439|event440|event441|event442|event443|event444|event445|event446|event447|event448|event449|event450|event451|event453|event454|event455|event456|event457|event458|event459|event460|event461|event462|event531|event532|event533|event534|event535|event536|event537|event538,,,6b6ea856-c6e5-11e2-8753-002590937d1c,1,EOL
dossier4,user2,Mainie Jellett,"An examination of the Irish artist, Mainie Jellett (1897-1944).",user2|user3|user5|user6|user7|user12|user14|user15|user16|user17|user18|user19|user20|user21|user22|user23|user24|user25|user26|user27|user28,user1|user2|user3|user4|user5|user6|user7|user8|user9|user10|user11|user12|user13|user14|user15|user16|user17|user18|user19|user20|user21|user22|user23|user24|user25|user26|user27,objectstory300|objectstory301|objectstory302|objectstory303|objectstory304|objectstory305|objectstory306|objectstory307|objectstory308|objectstory309|objectstory310|objectstory311|objectstory312|objectstory313|objectstory331|objectstory332|objectstory334|objectstory333|objectstory335|objectstory336|objectstory337,ref10|ref9|ref11|ref12|ref13|ref14,event529|event530|event524|event525|event526|event527|event528|event1|event516|event517|event520|event521|event522|event523|event514|event515|event513|event505|event506|event503|event504|event502|event500|event501|event1001|event1002|event1003|event1004|event1005|event1006|event1007|event1008|event1009|event1010|event1011|event1012|event1013|event1014|event1015|event1016|event1017|event1018|event1019|event1020|event1021|event1022|event1023|event1024|event1025|event1026|event1027|event1028|event1029|event1030|event1031|event1032|event1033|event1034|event1053|event1054|event1055|event1056|event1057|event1058|event1059|event1060|event1061|event1062|event505B|event506B|event503B|event504B|event502B|event500B|event501B,,story103,6de3974a-c6e5-11e2-8753-002590937d1c,0,EOL
dossier5,user2,Travelling artists,,user2|user3|user5|user6|user7|user12|user14|user15|user16|user17|user18|user19|user20|user21|user22|user23|user24|user25|user26|user27,user1|user2|user3|user4|user5|user6|user7|user8|user9|user10|user11|user12|user13|user14|user15|user16|user17|user18|user19|user20|user21|user22|user23|user24|user25|user26|user27,objectstory84|objectstory85|objectstory86|objectstory87,,,,,6ec0a2ca-c6e5-11e2-8753-002590937d1c,0,EOL
dossier6,user23,Claude Monet,An overview of Claude Monet’s life and work within the context of his engagement with the Impressionist movement. ,user2|user3|user5|user6|user7|user12|user14|user15|user16|user17|user18|user19|user20|user21|user22|user23|user24|user25|user26|user27|user28,user1|user2|user3|user4|user5|user6|user7|user8|user9|user10|user11|user12|user13|user14|user15|user16|user17|user18|user19|user20|user21|user22|user23|user24|user25|user26|user27,objectstory601|objectstory602|objectstory603|objectstory604|objectstory605|objectstory606|objectstory607|objectstory608|objectstory609|objectstory610|objectstory611|objectstory612|objectstory613|objectstory614|objectstory615|objectstory616|objectstory617|objectstory618|objectstory619|objectstory620|objectstory621|objectstory622|objectstory623,,event2001|event2002|event2003|event2004|event2005|event2006|event2007|event2008|event2009|event2010|event2011|event2012|event2013|event2014|event2015|event2016|event2017|event2018|event2019|event2020|event2021|event2022|event2023|event2024|event2025|event2026|event2027|event2028|event2029,,,6f028a32-c6e5-11e2-8753-002590937d1c,0,EOL
dossier7,user6,"The Lockout, Dublin 1913","The Dublin Lock-out was a major industrial dispute between approximately 20,000 workers and 300 employers which took place in Ireland's capital city of Dublin. The dispute lasted from 26 August 1913 to 18 January 1914, and is often viewed as the most severe and significant industrial dispute in Irish history. Central to the dispute was the workers' right to unionise.",user2|user3|user5|user6|user7|user12|user14|user15|user16|user17|user18|user19|user20|user21|user22|user23|user24|user25|user26|user27|user28,user6|user27,objectstory524|objectstory525,,event539|event540|event541|event542|event543|event544|event545|event546|event547|event548|event549|event550|event551|event552|event553|event554|event555|event556|event557|event558|event559|event560|event561|event562,,,59bdbaea-ea47-11e2-8753-002590937d1c,0,EOL
